{
  "decision_digest": "sha256:0000000000000000000000000000000000000000000000000000000000000000",
  "expected_head_sha": "0000000000000000000000000000000000000000",
  "operation_id": "op-merge-0000000000000000000000000000000000000000000000000000000000000000",
  "operation_ref": "refs/heads/delivery-operations/op-merge-0000000000000000000000000000000000000000000000000000000000000000",
  "schema_version": 1,
  "status": "intent_committed"
}
